Product Name,Company Name,Product Type,Category,Cleaned Price
Side Mounted Water Tank Resistant to Moisture Liquid Level Sensor Float Switch,"Dongguan Fuen Electronics Co., Ltd.",soil moisture sensors,Electronics,2.0
Taiwan Household Electric Moisture Absorber Humidity Sensor Dehumidifier for Extra Large Room,"Guangdong Invitop Technology Co., Ltd.",soil moisture sensors,Electronics,77.99
Motion Sensor Wall Light Lighting Moisture Proof Outdoor Garden Lamp,"Zhongshan Fantas Lighting Co., Ltd.",soil moisture sensors,Electronics,5.65
Digital Multifunctional LCD Grain Moisture Meter Water Content Analyzer Smart Sensor Use Probe Humidity Tester for Wheat Corn Rice Bean Peanut Soybean,"Shenzhen GVDA Technology Co., Ltd.",soil moisture sensors,Electronics,9.99
Transformer Oil Moisture Detector/Oil Moisture Sensor/ Water Content Tester,"CHONGQING ZANYO ELECTROMECHANICAL AND MACHINERY CO., LTD.",soil moisture sensors,Electronics,3100.0
Bluetooth Le5.0 Beacon Tag Ibeacon with Humidity Temperature and Acceleration Sensor for Indoor Tracking Smart,"Shenzhen Rf-Star Technology Co., Ltd.",soil moisture sensors,Electronics,6.95
Customized PCB Solutions Power Electronics RF Filter Signal Integrity IoT Sensor PCB Supplier OEM ODM,Shenzhen Tecircuit Electronic Limited,soil moisture sensors,Electronics,1.0
Cheap Price Eto C2h4 Ethylene Sterilizer Price Cylinder Industrial Use,"Shandong Yizhong Industrial Co., Ltd",soil moisture sensors,Electronics,20.0
Cheap Price 99.999% 5.0n Ethylene Gas Cylinder Gas,"Shandong Yizhong Industrial Co., Ltd",soil moisture sensors,Electronics,20.0
Digital Temperature Humidity Data Logger 4G Connection 24h Monitoring for Vaccine Storage Cold Storage Breeding,"Zhengzhou Freshliance Electronics Corp., Ltd",soil moisture sensors,Electronics,95.0
Custom cnc machined Waterproof Valve Actuators for Smart Irrigation,"Dongguan Huahang Xinma Metal Co., Ltd.",soil moisture sensors,Electronics,7.9
Strontium Zirconate Srzro3 CAS 12036-39-4,"Qingdao Jinyu Chemical Co., Ltd",soil moisture sensors,Electronics,1.0
"0.96"" OLED 1602 LCD Display Relay Servo Motor Dht11 Sensor Module for Arduino Starter Kits","Shenzhen Chengsuchuang Technology Co., Ltd.",soil moisture sensors,Electronics,20.0
RS485 Online pH Meter Detection Instrument Water Quality Test Sensor,"Shenzhen Toprie Electronics Co., Ltd.",soil moisture sensors,Electronics,139.0
RS485 Soil Temperature and Humidity Meter 4-20mA Moisture Detector Moisture Meter IP68,"Shenzhen Toprie Electronics Co., Ltd.",soil moisture sensors,Electronics,39.0
Electronics Non-Nuclear Density Gauge for Road and Soil Compaction Testing,"Win(Tianjin) Machinery Business Co., Ltd",soil moisture sensors,Electronics,3000.0
Portable Electronics Non-Nuclear Density Gauge for Soil and Asphalt Testing,"Win(Tianjin) Machinery Business Co., Ltd",soil moisture sensors,Electronics,3000.0
Wireless 4G GPS GSM SMS GPRS Temperature Humidity Alarm Sensor Controller Monitor Data Logger System,"Zhengzhou Freshliance Electronics Corp., Ltd",soil moisture sensors,Electronics,95.0
Automatic Watering Pump Automatic Irrigation Module DIY Set for Arduino Kit,"Shenzhen Ke Zhi You Technology Co., Ltd.",soil moisture sensors,Electronics,6.8
Ultrasonic Vapor Degreasing Machine Two Stages Automated Degreaser of Dual Tanks Refrigeration Cooled Solvent Cleaning Equipment,"Shenzhen Keepleader Machinery Co., Ltd.",soil moisture sensors,Electronics,6000.0
Tr-Ts01 Stable Performance Fdr Soil Moisture Sensor Soil Moisture Sensor,"Sichuan Weinasa Technology Co., Ltd.",soil moisture sensors,Electronics,38.0
Takeme-10ec Soil Temperature Moisture Sensor Sht10 Soil Conductivity Meter GSM Soil Moisture,"Sichuan Weinasa Technology Co., Ltd.",soil moisture sensors,Electronics,192.0
Capacitive Soil Moisture Sensor Module Not Easy to Corrode Wide Voltage Wire 3.3~5.5V Corrosion Resistant W/ Gravity for Arduino,"HW INDUSTRIAL CO., LTD",soil moisture sensors,Electronics,1.0
Bgt Advanced Soil Temp Moisture Ec Sensor for Smart Agriculture Use,"BGT Technology(Beijing) Co., Ltd.",soil moisture sensors,Electronics,159.99
Bgt Advanced Precision Smart SDI12 Rockwool Cultivation Soil Substrate Moisture Temperature Ec Tester,"BGT Technology(Beijing) Co., Ltd.",soil moisture sensors,Electronics,179.99
Discounted Agricultural Planting RS485 Soil Sensor Test Ec/TDS/Salt/Temp/Moisture,"Henan Bingsheng Industrial Co., Ltd.",soil moisture sensors,Electronics,24.6
USB 7 in 1 Soil Moisture Sensor pH Moisture Temp Ec Salinity NPK Soil Sensor for Agriculture Plant Soil,"Henan Bingsheng Industrial Co., Ltd.",soil moisture sensors,Electronics,10.5
Handheld Agriculture Soil Moisture Temperature and Moisture Sensor for Agriculture Greenhouse,"Chengdu Sentec Technology Co., Ltd.",soil moisture sensors,Electronics,125.0
Sem225 4-20mA RS485 Ec Electric Conductivity pH Soil Moisture Sensor Soil NPK,"Chengdu Sentec Technology Co., Ltd.",soil moisture sensors,Electronics,29.0
Firstrate FST100-2006 Analog Output Soil Temperature Humidity Transmitter Soil Moisture RS485,"Hunan Firstrate Sensor Co., Ltd.",soil moisture sensors,Electronics,40.0
China Manufactory Moisture Soil Sensor to Measure Level of Water on Soil,"Atech Sensor Co., Ltd",soil moisture sensors,Electronics,28.0
Ms20 Soil Moisture and Temperature Sensor,"Shenzhen Bonad Instrument Co., Ltd.",soil moisture sensors,Electronics,60.0
DC 12V Industrial Iot RS485 3 in 1 Soil Moisture Sensor for Agriculture,"Hefei Siko Instruments Co., Ltd.",soil moisture sensors,Electronics,57.0
Rk520-01 4-20mA 0-5V Analog Soil Moisture Temperature Probe Sensor for Greenhouse,"Hunan Rika Electronic Tech Co., Ltd.",soil moisture sensors,Electronics,29.0
Rika Rk520-01 High Precision 4-20mA RS485 Soil Temperature Moisture Probe Sensor,"Hunan Rika Electronic Tech Co., Ltd.",soil moisture sensors,Electronics,29.0
LCD Display Digital 5 Layers Soil Moisture and NPK 4 in 1 pH and Ec Probe Sensor for Soil,"Hefei Siko Instruments Co., Ltd.",soil moisture sensors,Electronics,57.0
Tuya Smart Zigbee 3.0 Wireless Flower Plant Care Monitor Soil Moisture Temperature Sensor,"Hangzhou FrankEver Imp. & Exp. Co., Ltd.",soil moisture sensors,Electronics,15.0
Sht20 Sht21 Sht31 Sht35 Agriculture Soil Moisture Sensor Humidity and Temperature Sensor,SENSTECH LTD.,soil moisture sensors,Electronics,0.99
Tuya Smart Wireless WiFi Zigbee Soil NPK Sensor Soil Moisture Sensor,"Hangzhou FrankEver Imp. & Exp. Co., Ltd.",soil moisture sensors,Electronics,14.8
Metal Housing Agriculture Soil Moisture Sensor Temperature and Humidity Sensor WiFi Sht30 Sht31 Sht5 Sht45 0-10V,SENSTECH LTD.,soil moisture sensors,Electronics,5.5
E-201-C Surface Soil Water pH Electrode Top Sales in The Shop Liquid-Free Combination Sensor Probe,"REX (Shanghai) Technology Co., Ltd.",soil moisture sensors,Electronics,8.0
E-201 Online Water pH Sensor No Liquid Filling No. 1 in Hot Sales pH Meter Soil Sensor Probe Electrode,"REX (Shanghai) Technology Co., Ltd.",soil moisture sensors,Electronics,8.0
Angle Sensor Digital Rock and Soil High-Speed Rail Subway Foundation Pit Inclinometer Angle Sensor Modbus Digital Output Circuit Board,Suzhou Miluo Technology Company,soil moisture sensors,Electronics,135.0
CS1515 pH Sensor moist soil measurement,"Shanghai Chunye Instrument Technology Co., Ltd.",soil moisture sensors,Electronics,150.0
Factory Price Industrial 4-20mA Water Soil pH Sensor Probe,"Shanghai GL Environmental Technology Co., Ltd.",soil moisture sensors,Electronics,12.0
RS-Tr-Lora-2 Lora Soil Sensor,"Chongqing Jiuxin Automation Technology Co., Ltd",soil moisture sensors,Electronics,37.86
water quality testing ph meter probe 4-20mA Soil PH Probe Sensor CS1700/1701C,"Shanghai Chunye Instrument Technology Co., Ltd.",soil moisture sensors,Electronics,80.0
Soil Temperature and Humidity Sensor 3.3 V to 5 V,"Shenzhen Ke Zhi You Technology Co., Ltd.",soil moisture sensors,Electronics,0.35
Karl Fischer Moisture Sensor (TP-2100),"Chongqing TOP Oil Purifier Co., Ltd.",soil moisture sensors,Electronics,1000.0
WiFi Tuya APP Temperature and Humidity Control LCD Screen Digital Moisture Meter Wireless Temperature and Humidity,"Yueqing Winston Electric Co., Ltd.",soil moisture sensors,Electronics,17.99
"Manufacturer Ppm-Hlw-2b OEM Moisture in Oil Monitor Meter, Smart Moisture Content Sensor","Changsha Taihe Electronic Equipment Co., Ltd.",soil moisture sensors,Electronics,880.0
Skz111b-2 Handheld Menu Type CE Certification 8%-35% Moisture Testers Coffee Beans Cacao Beans Radish Seeds Vanilla Test Device Grain Humidity,"SKZ International Co., Ltd.",soil moisture sensors,Electronics,110.0
Skz111c-4 Portable 1 Year Warranty Moisture Testers Device Humidity Sensor,"SKZ International Co., Ltd.",soil moisture sensors,Electronics,330.0
Automatic Sliding Door 24V Photobeam Vehicle Moisture Gate Sensor Diffuse Reflection for Gate Motor,"Giant Alarm System Co., Ltd.",soil moisture sensors,Electronics,18.0
RS485/4~20mA Wireless Temperature and Humidity Transmitter Dew Point Sensor Probe Grain Moisture Meter for Flower Nursery,"Meokon Sensor Technology (Shanghai) Co., Ltd.",soil moisture sensors,Electronics,25.68
Hydro-Mix Moisture Sensor for Hydronix Chutes Probe,"SHANDONG MACPEX MACHINERY EQUIPMENT CO., LTD.",soil moisture sensors,Electronics,1000.0
Fleetguard Moisture Content Sensor 395715800s for Cummins Engine Part,"Chengdu Raptors Mechanical & Electrical Equipment Co., Ltd.",soil moisture sensors,Electronics,50.0
Cheap Prices Temperature and Humidity Transmitter Dew Point Sensor Probe Grain Moisture Meter for Workshop,"Meokon Sensor Technology (Shanghai) Co., Ltd.",soil moisture sensors,Electronics,25.68
Ppm Hydraulic Oil Transformer Oil Online Moisture Sensor,"Chongqing TOP Oil Purifier Co., Ltd.",soil moisture sensors,Electronics,1000.0
Kjt M6 Moisture-Proof IP67 Sn 120mm Optical Fiber Probe Amplifier Sensor,"Nanjing KJT Electric Co., LTD",soil moisture sensors,Electronics,4.88
Moisture-Proof Sn 8mm M12 Non-Flushed PNP Nc 3 Wires 10-36VDC Proximity Sensor,"Nanjing KJT Electric Co., LTD",soil moisture sensors,Electronics,3.2
Grain Moisture Meter Digital Moisture Meter Smart Sensor Use for Corn,"Zhengzhou Sinoder Indutech Machinery Co., Ltd.",soil moisture sensors,Electronics,120.0
Automotive Electronics Parts 89542-0K050 89543-0K050 for Hilux ABS Sensor,"Guangzhou Fengming Auto Parts Co., Ltd.",soil moisture sensors,Electronics,10.0
Smart Ethylene Gas Sensor for Electronics Industry Solutions,"Ningxia Maiya Sensor Technology Development Co., Ltd",soil moisture sensors,Electronics,94.0
Timer Water Valve Sensor Smart Controller WiFi Solar Pump Farm Irrigation System,"Atech Sensor Co., Ltd",soil moisture sensors,Electronics,22.0
Solar+3200 mAh Battery Watering System Rain Sensor Controller Smart Irrigation System,"Atech Sensor Co., Ltd",soil moisture sensors,Electronics,22.0
Ppm-T293A Hammer Union Fitting 1502 Pressure Sensor for Oil Well,"Changsha Taihe Electronic Equipment Co., Ltd.",soil moisture sensors,Electronics,399.0
Low Cost High Quality Pressure Sensor Ppm-T322h,"Changsha Taihe Electronic Equipment Co., Ltd.",soil moisture sensors,Electronics,20.0
10t 20t 30t 40t Amcells Lpd Series Q1 Smart Low Profile Weighing Scale Force Sensor,"Locosc Ningbo Precision Technology Co., Ltd.",soil moisture sensors,Electronics,23.5
Online Smart Farming Premium Quality RS485 Water pH & Ec Sensor,"BGT Technology(Beijing) Co., Ltd.",soil moisture sensors,Electronics,105.3
Professional RS485 Sensor with Ec Range and Quick Response Time,"Henan Bingsheng Industrial Co., Ltd.",soil moisture sensors,Electronics,29.9
Locosc Lp7134 Weighing Bridge Loadcell Sensor for Truck Scale 10ton 20ton 40ton,"Locosc Ningbo Precision Technology Co., Ltd.",soil moisture sensors,Electronics,65.0
RS485 Sensor with Ec Range 0-20000us/Cm and IP68 Protection,"Henan Bingsheng Industrial Co., Ltd.",soil moisture sensors,Electronics,29.9
pH Sensor Module Agricultural Equipment pH Sensor 4-20mA,"Sichuan Weinasa Technology Co., Ltd.",soil moisture sensors,Electronics,139.0
Automotive Parts A0009056204 Nitrogen Oxide Sensor Suitable for Bm and Ben,"QINGDAO SATA IMPORT AND EXPORT CO., LTD.",soil moisture sensors,Electronics,130.0
Dental Medical X Ray Sensor for X Ray Machine,"Foshan Senda Medical Instrument Co., Ltd.",soil moisture sensors,Electronics,360.0
Intelligent Wheel Shape Load Cell Spoke Type Force Sensor 250kg,"Huzhou Zhihe Technology Co., Ltd.",soil moisture sensors,Electronics,89.0
Automotive Parts Oxygen Sensor Suitable for Bd Air Fuel Ratio Sensor 0258006937 Oxygen Sensor 0258986602,"QINGDAO SATA IMPORT AND EXPORT CO., LTD.",soil moisture sensors,Electronics,12.0
Digital ORP Sensor Surface Water pH Sensor,Santo (China) Limited,soil moisture sensors,Electronics,375.0
50t 70t Spoke Type Load Cell Sensor Weighing Sensor with CE RoHS ISO Certification,"Huzhou Zhihe Technology Co., Ltd.",soil moisture sensors,Electronics,55.0
Oil Metal Particle Sensor,"Guangzhou NextGen Technology CO.,LTD",soil moisture sensors,Electronics,10.0
Advanced Non-Corrosive Gas Humidity Sensor for Precise Monitoring,"Hangzhou Xinjian Electronic Co., Ltd.",soil moisture sensors,Electronics,300.0
Suto S217 Industrial-Grade Dew Point Sensor Time for Process Monitoring with Fast Response,"Hangzhou Xinjian Electronic Co., Ltd.",soil moisture sensors,Electronics,300.0
Automated Control Infrared on Line Noisture Sensor for Paper After Dried Thermal Paper,"SKZ International Co., Ltd.",soil moisture sensors,Electronics,7125.0
Infrared  Touchless Sensor,"Hangzhou Safedoor Automation & Hardware Co., Ltd.",soil moisture sensors,Electronics,5.0
300A 24V 500A 750A Power Inverter Hall Effect Current Sensor,"Tianjin Grewin Technology Co., Ltd.",soil moisture sensors,Electronics,6.0
500A 750A 800A 1200A 20kHz Hall Effect Current Sensor,"Tianjin Grewin Technology Co., Ltd.",soil moisture sensors,Electronics,6.0
Photocell Infrared Sensor Sh-pH02,"HUZHOU SHAREH HOME CO., LTD",soil moisture sensors,Electronics,3.0
High Quality Auto Fuel Rail Pressure Sensor 499000-6131 for Nissan Isuzu,"Guangzhou Xinlechi Auto Parts Co., Ltd",soil moisture sensors,Electronics,0.5
Automotive Fuel Rail Pressure Sensor for Ford Peugeot Citroen 85PP75-01,"Guangzhou Xinlechi Auto Parts Co., Ltd",soil moisture sensors,Electronics,0.5
Xlh535200.000000I 6-Smdnolead IC Chip Optical Sensors Pressure Sensors,"Usun Electronics Limited.,",soil moisture sensors,Electronics,0.1
"4 in 1 Soil Tester Plant Moisture Sensor Meter/Light/pH/Temperature Tester for Home, Garden, Lawn, Farm Use","Ningbo Ecowis Plastic & Electric Co., Ltd.",soil moisture sensors,Electronics,2.8
Soil Moisture Sensor Monitoring Solar Power Station Monitor System Portable Solar Power Station,"Sichuan Weinasa Technology Co., Ltd.",soil moisture sensors,Electronics,1360.0
Smart Irrigation Early Warning Systems Soil Moisture Sensor Soil Temperature Monitoring Weather Station,"Sichuan Weinasa Technology Co., Ltd.",soil moisture sensors,Electronics,983.0
Advanced Digital Soil pH and Moisture Meter Sensor GM760,"Changzhou KB Instruments & Meter Co., Ltd.",soil moisture sensors,Electronics,19.9
Best Quality Handheld Photosensitve Type One Sensor Soil Moisture Tester for Indoor and Outdoor Plants,"Hebei Yuhan Electronic Technology Co., Ltd.",soil moisture sensors,Electronics,7.45
Soil Tester Soil pH Meter Moisture Tester Light Sensor Meter Plant Tester for Garden Lawn Farm,"Xi'an Lonn M&E Equipment Co., Ltd.",soil moisture sensors,Electronics,11.5
Sdt Series Soil Moisture Meter for Garden Plants Humidity pH Testing Sensor,"Shijiazhuang Sanli Grain Sorting Machinery Co., Ltd.",soil moisture sensors,Electronics,60.0
Portable Digital Soil pH Moisture Meter Sensor for Soil Water Tester,"Shijiazhuang Sanli Grain Sorting Machinery Co., Ltd.",soil moisture sensors,Electronics,60.0
Skz111K 0-80% Digital Sand Moisture Meter Agriculture Soil Moisture Sensor,"SKZ International Co., Ltd.",soil moisture sensors,Electronics,330.0
Most Popular Skz111j Wholesale Digital Soil Moisture Sensor Meter,"SKZ International Co., Ltd.",soil moisture sensors,Electronics,7125.0
Portable Handheld Intelligent Digital Soil pH NPK Moisture Nutrient Sensor Tester Kit Soil Analyzer with LCD Display,"Hangzhou FrankEver Imp. & Exp. Co., Ltd.",soil moisture sensors,Electronics,35.0
7-in-1 Soil Tester Temperature Humidity Sensor Transmitter Greenhouse Agriculture RS485 Moisture Conductivity Ec NPK pH Detector,"Hangzhou FrankEver Imp. & Exp. Co., Ltd.",soil moisture sensors,Electronics,49.9
Soil Humidity Detecting Instrument Soil Moisture Sensor Humidity Detection Module,JIANGXI NEW SILK ROAD INDUSTRY & TRADE COMPANY LIMITED,soil moisture sensors,Electronics,0.15
Oil Pressure Sensor Transmitter Oilfield Downhole Mud Brick Making Wet Soil,"Atech Sensor Co., Ltd",soil moisture sensors,Electronics,357.0
RS485 Smart NPK Soil Analyzing Sensor for Precision Farming & Horticulture,"BGT Technology(Beijing) Co., Ltd.",soil moisture sensors,Electronics,35.3
Primary Non Rechargeable Battery Er26500m 3.6V C Size Lithium Battery Er26500 for Soil Wireless,"Shenzhen Pkcell Battery Co., Ltd",soil moisture sensors,Electronics,3.42
Industrial-Grade Digital Soil NPK Measurement Sensor IoT Farmimg,"BGT Technology(Beijing) Co., Ltd.",soil moisture sensors,Electronics,35.3
Rk500-22 Factory Price Industrial 4-20mA RS485 Online Soil pH Sensor Transmitter,"Hunan Rika Electronic Tech Co., Ltd.",soil moisture sensors,Electronics,208.0
Agricultural Weather Station with Soil Sensor and Rain Gauges,"Hunan Rika Electronic Tech Co., Ltd.",soil moisture sensors,Electronics,799.0
Soil Tensiometer Used Sensor Porous Ceramic Tube Cup with Plastic Part,"LIANYUNGANG BAIBO NEW MATERIAL CO., LTD.",soil moisture sensors,Electronics,2.0
30t-1000t Ai-Controlled Wheat Flour Mill  Smart Sensors for Real-Time Moisture & Protein Content Adjustment,"Hebei Pingle Flour Machinery Group Co., Ltd.",soil moisture sensors,Electronics,200000.0
15kw Bt4/CT4 Submersible Sewage Pump Double Seal Moisture Detection Sensor,"Jining Antai Mine Equipment Manufacturing Co., Ltd.",soil moisture sensors,Electronics,800.0
Paoers Everydayguard Leakproof Disposable Pull-up Pants with Moisture Sensor,"Hebei Jinjie Health Technology Co., Ltd.",soil moisture sensors,Electronics,0.15
Veidt Weighing Vs120t 120g 1mg Plastic Skin Detector 1mg Touch Screen Moisture Analyzer with Hbm Load Cell,"Changzhou Veidt Weighing Co., Ltd.",soil moisture sensors,Electronics,400.0
Car Battery Charger Circuit Board Bluetooth Headphone Moisture Sensor Scustom Trip PCB PCBA,Finest Printed Circuit Board Ltd.,soil moisture sensors,Electronics,2.0
Coal Infrared Nir Acid Grain Online Humidity Moisture Thickness Sensor Meter Analyzer,"Jinan Cyeeyo Instruments Co., Ltd.",soil moisture sensors,Electronics,6700.0
Food Infrared Online Coal Moisture Meter Analyzer Sensor,"Jinan Cyeeyo Instruments Co., Ltd.",soil moisture sensors,Electronics,6700.0
Hydarulic Oil Transformer Oil Online Particle Counter with Moisture Sensor,"Chongqing Blossom Machinery Equipment Co., Ltd.",soil moisture sensors,Electronics,1500.0
Garden Greenhouse LED Grow Light Plastic 200micron UV Automatic Moisture Sensor for Greenhouses,"Guangdong Huixin Metal Products Co., Ltd.",soil moisture sensors,Electronics,298.0
Moisture-Proof & Dustproof High-Voltage Liquid Oil Level Sensor Monitor Oil Level Indicator for Transformer,"Anhui Shine Electric Power Technology Co., Ltd",soil moisture sensors,Electronics,10.0
Improve Disease Resistance Compound Chemical Fertilizers Balanced NPK Fertilizers,"HUBEI KAILONG CHUXING CHEMICAL INDUSTRY GROUP CO., LTD.",fertilizers,Chemical,349.0
Best Price NPK 12 24 12 Compound Chemical Fertilizer,"Shijiazhuang Lemandou Chemicals Co., Ltd.",fertilizers,Chemical,1.2
Hot Sale Color 100% Water Soluble Chemical Fertilizer NPK20-20-20+Te Agricultural Compound NPK,"SHANDONG MINGYU CHEMICAL CO.,LTD",fertilizers,Chemical,800.0
Chemical Fertilizer Good Effect for Plant Calcium Ammonium Nitrate,"Shijiazhuang Lemandou Chemicals Co., Ltd.",fertilizers,Chemical,220.0
Potassium Nitrate Chemicals Kno3 Fertilizer/Industrial Grade Potassium Nitrate Kno3 99.4%,"SHANDONG MINGYU CHEMICAL CO.,LTD",fertilizers,Chemical,760.0
Fully Water-Soluble NPK Compound Fertilizer for Agriculture  Chemical Plant Use,"HUBEI KAILONG CHUXING CHEMICAL INDUSTRY GROUP CO., LTD.",fertilizers,Chemical,329.0
Water Soluble Fertilizer Material Chemical Monopotassium Phosphate Fertilizer MKP 0-52-34 Map 12-61-0,"SHANDONG MINGYU CHEMICAL CO.,LTD",fertilizers,Chemical,1150.0
Ammonium Chloride Granulesr N25% (GAS) Chemical Fertilizer,"JIANGXI ZHANHONG AGRICULTURAL DEVELOPMENT CO., LTD.",fertilizers,Chemical,110.0
Ammonium Sulfate Crystal N21% (GAS) Chemical Fertilizer,"JIANGXI ZHANHONG AGRICULTURAL DEVELOPMENT CO., LTD.",fertilizers,Chemical,150.0
Competitive Factory Price Urea Granular Urea 46% Chemical NPK Fertilizer with Best Quality for Agriculture,Qingdao Sonef Chemical Company Limited,fertilizers,Chemical,260.0
Factory Direct Supply Chemical Reagents Ammonium Sulfate Nitrogen Fertilizer,"VIZDA INDUSTRIAL CO., LIMITED",fertilizers,Chemical,100.0
Agricultural Chemical Fertilizer Manufacturers NPK 15-15-15+MGO+Te for Vegetables and Fruits,"Xingtai Ruijin Import and Export Co., Ltd.",fertilizers,Chemical,299.0
China Factory Price Chemical Fertilizer Map,"Shijiazhuang Lemandou Chemicals Co., Ltd.",fertilizers,Chemical,800.0
Factory Price Granular Water Soluble Chemical Compound NPK Fertilizer with NPK15-15-15,"Hebei Debien Technology Co., Ltd.",fertilizers,Chemical,350.0
Granular Ammonium Sulfate N21% (GAS) Chemical Fertilizer,"JIANGXI ZHANHONG AGRICULTURAL DEVELOPMENT CO., LTD.",fertilizers,Chemical,150.0
NPK 17-17-17 Granular Chemical Fertilizer OEM Formula Fully Water-Soluble for Agriculture,"HUBEI KAILONG CHUXING CHEMICAL INDUSTRY GROUP CO., LTD.",fertilizers,Chemical,349.0
Ammonium Chloride Powder N25% (GAS) Chemical Fertilizer,"JIANGXI ZHANHONG AGRICULTURAL DEVELOPMENT CO., LTD.",fertilizers,Chemical,90.0
Gas -Ammonium Sulfate Granule Chemical Fertilizer,"JIANGXI ZHANHONG AGRICULTURAL DEVELOPMENT CO., LTD.",fertilizers,Chemical,150.0
Competitive Price Granular/Powder Chemical Water Soluble NPK Compound Fertilizer 20 20 15,Qingdao Sonef Chemical Company Limited,fertilizers,Chemical,300.0
Cheap and Hot Selling High Quality Chemical NPK Compound Water Soluble Fertilizer,"Hebei Fuzhe Laize Industrial Co., Ltd",fertilizers,Chemical,180.0
Organic Granular Fertilizer NPK 15-15/17-17-17 Agriculture Compound D Chemical Fertilizer,"Jiangsu Tiandong Biotechnology Co., Ltd.",fertilizers,Chemical,280.0
Factory Price Granular Water Soluble Chemical Compound NPK Fertilizer with NPK15-15-15/ 17-17-17,"Bolin International Trade (Tianjin) Co., Ltd.",fertilizers,Chemical,260.0
"Ammonium Sulfate, Chemical Fertilizer N 21%","Jinan ZZ International Trade Co., Ltd.",fertilizers,Chemical,250.0
Factory Price Granular Water Soluble Chemical Compound NPK Fertilizer with NPK15-15-15/ 17-17-17/NPK12-12-17+2MGO/NPK16-16-8,"SHANDONG MINGYU CHEMICAL CO.,LTD",fertilizers,Chemical,206.0
EDDHA Fe6% Fe Iron EDDHA Chelated Organic Fertilizer Chemical Fertilizer Red Brown,"Shijiazhuang Lemandou Chemicals Co., Ltd.",fertilizers,Chemical,5.5
Balancing Soil Environment Compound Chemical Fertilizers Incomplete NPK Fertilizers,"HUBEI KAILONG CHUXING CHEMICAL INDUSTRY GROUP CO., LTD.",fertilizers,Chemical,349.0
Agriculture Chemical Neutral Urea Granular Fertilizer,"Jinan ZZ International Trade Co., Ltd.",fertilizers,Chemical,225.0
Nitrogen Fertilizer Ammonium Sulphate 21 N Chemical Fertilizer with 24 Sulfur as Fertilizer Granular Powder or Crystal,"Shijiazhuang Han Hao Trade Co., Ltd.",fertilizers,Chemical,0.15
Agricultural Grade China Factory Supply Chemical NPK 8-24-24 Compound Fertilizer,"SHANDONG MINGYU CHEMICAL CO.,LTD",fertilizers,Chemical,300.0
Top Quality Chemical Potassium Nitrate with K2o 46% Nitrato De Potassio Garden Fertilizer,"Wuhan Kangzheng Science and Technology Co., Ltd.",fertilizers,Chemical,1000.0
Easy to Use NPK 15-15-15 Granular Compound Fertilizer Chemical Fertilizer Prices for Agriculture Crops,"HUBEI KAILONG CHUXING CHEMICAL INDUSTRY GROUP CO., LTD.",fertilizers,Chemical,349.0
China Vegetables NPK Chemical Compound Fertilizer,"Xuzhou Kailiya New Material Co., Ltd.",fertilizers,Chemical,380.0
MKP plant food (KH2PO4) Potassium Dihydrogen Phosphate chemical fertilizer,"Chico Crop Science Co., Ltd.",fertilizers,Chemical,0.1
EDDHA Fe6% EDDHA Chelated Chemical Fertilizer Organic Fertilizer Granular Powder,"Shijiazhuang Lemandou Chemicals Co., Ltd.",fertilizers,Chemical,5.5
Chemical Fertilizers Urea Granular Slow Release Low Biuret Urea 46% Nitrogen,"Jilu Henghua (Hebei) Technology Co., Ltd",fertilizers,Chemical,350.0
Sinopec Ammonium Sulphate Certified by Australian Fertilizers Special Warehouse Used for Chemical Reagent,"SINOPEC Baling Petrochemical Co., Ltd.",fertilizers,Chemical,100.0
Potassium Nitrate Powder Water Soluble Fertilizer for Agriculture Potassium Nitrate Chemicals,"Shandong Xuke Chemical Technology Co., Ltd",fertilizers,Chemical,780.0
Supply Organic Fertilizer Chemicals Organic Chelator of Trace Elements,"Qingdao Haidelong Biotechnology Co., Ltd.",fertilizers,Chemical,5.7
Chemical Fertilizer NPK (customized formula),"Jinan ZZ International Trade Co., Ltd.",fertilizers,Chemical,430.0
Granular Fertilizer NPK 14-18-18+Te Agriculture Compound Chemical Fertilizer,"SHANDONG MINGYU CHEMICAL CO.,LTD",fertilizers,Chemical,206.0
Chemical Fertilizer Agriculture MKP Monopotassium Phosphate NPK Fertilizer,"Chengdu Dova New Material Co., Ltd.",fertilizers,Chemical,1000.0
"Chemical High Temperature Catalyst, Fertilizer Catalyst for Chloride Removal, Fine Dechlorination Agent Kh405","Kunshan Huahai Environmental Protection Technology Co., Ltd.",fertilizers,Chemical,1600.0
Quick Effect Chemical Agriculture Fertilizer NPK 22-9-9 Compound Fertilizer,"HUBEI KAILONG CHUXING CHEMICAL INDUSTRY GROUP CO., LTD.",fertilizers,Chemical,349.0
