Product Name,Company Name,Product Type,Category,Cleaned Price
2CZ-4c Agricultural Equipment Multifunction Sugarcane Seed Planter Machine Sugar Cane Seeder,"ACME AGRO HUBEI CO.,LTD.",seed planter,Agricultural Equipment,6800.0
Adjustable Seed Planter with White Radish for Agricultural Equipment,"Qingdao Dashun Jingfeng Industry and Trade Co., Ltd.",seed planter,Agricultural Equipment,15000.0
Double Ridge Four-Row Potato Planter Tractor-Mulching Machine for Potato Seeds Agricultural Machinery &,"Qingdao Hong Zhu Agricultural Machinery Co., Ltd",seed planter,Agricultural Equipment,2400.0
Double Ridge Four-Row Potato Planter Tractor-Mulching Machine for Potato Seeds Other Machinery &,"Qingdao Hong Zhu Agricultural Machinery Co., Ltd",seed planter,Agricultural Equipment,2400.0
Manufacturer Potato Planter Agricultural Equipment Seeder Potato Planter for Walking Tractor Seed,"Qingdao Hong Zhu Agricultural Machinery Co., Ltd",seed planter,Agricultural Equipment,2400.0
Agricultural Equipment Supply by Factory 4 Row Working Powerful & Stable Potato Seed Planter,"Qingdao Hong Zhu Agricultural Machinery Co., Ltd",seed planter,Agricultural Equipment,2400.0
Adjustable Vegetable Seed Planter with Beet for Agricultural Equipment,"Qingdao Dashun Jingfeng Industry and Trade Co., Ltd.",seed planter,Agricultural Equipment,15000.0
Precision Vegetable Seed Planter for Agricultural Equipment,"Qingdao Dashun Jingfeng Industry and Trade Co., Ltd.",seed planter,Agricultural Equipment,15000.0
Tractor-Mulching Machine Potato Seeds Planter Agricultural Machinery and Equipment for Potatoes,"Qingdao Hong Zhu Agricultural Machinery Co., Ltd",seed planter,Agricultural Equipment,2400.0
Agricultural Tractor Manual Sale of 1 2 3 4 5 6 7 Rows Corn Seed Stick Wholesale Maize Planter and Seeder Machine in Peru for Tractor,"Shandong Ling ke Industry Group Co., Ltd",seed planter,Agricultural Equipment,199.0
Farm Equipments Corn Planter Corn Seed Planter,"YUCHENG HONGRI MACHINERY MANUFACTURE CO., LTD.",seed planter,Agricultural Equipment,300.0
High Quality Agricultural Equipment Double Ridge Planter for Potato 4 Row Seeding Machine,"Qingdao Hong Zhu Agricultural Machinery Co., Ltd",seed planter,Agricultural Equipment,2400.0
Farm Equipment 4 Row 5 Rows Corn Seed Planer Corn Planting Machine Corn Seed Planter for Tractors,"Yucheng Hengshing Machinery Co., Ltd.",seed planter,Agricultural Equipment,690.0
Hot Sale 2 Row Potato Farming Equipment Tractor Potato Planter Machine Pto Tractor Garlic Planter,"Qingdao Hong Zhu Agricultural Machinery Co., Ltd",seed planter,Agricultural Equipment,2400.0
Planting Machine Agricultural Seeds Two Row Potato Seed Planter Machine for Sale,"Qingdao Hong Zhu Agricultural Machinery Co., Ltd",seed planter,Agricultural Equipment,2400.0
New Design Two Rows Agricultural Equipment Planting Machine Potato Planter with Fertilizer Applicator,"Qingdao Hong Zhu Agricultural Machinery Co., Ltd",seed planter,Agricultural Equipment,2400.0
Farm Equipment Corn Sowing Machine Corn Seed Planter Hitched Maize Planting Machine,"Baoding Harvest Import and Export Trading Co., Ltd.",seed planter,Agricultural Equipment,900.0
220V Automatic Hole Tray Seedling Machine Needle Suction Planting Machine Vegetable Seedling,"Qingdao Dashun Jingfeng Industry and Trade Co., Ltd.",seed planter,Agricultural Equipment,8000.0
Farm Equipment Soybean Peanut Fertilizer and Transplanter Corn Seeder Machine Manual Seed,"Dezhou Lufa Machinery Co., Ltd",seed planter,Agricultural Equipment,130.0
Tractor 4 Rows Agricultural Seeds Potato Planter Seeder Machine with Wholesale Price,"Qingdao Hong Zhu Agricultural Machinery Co., Ltd",seed planter,Agricultural Equipment,2400.0
Efficient Pneumatic Vegetable Planter Stable and Precise Farm Equipment,"Qingdao Dashun Jingfeng Industry and Trade Co., Ltd.",seed planter,Agricultural Equipment,7000.0
Advanced Pneumatic Vegetable Planter for Agricultural Equipment on Farm,"Qingdao Dashun Jingfeng Industry and Trade Co., Ltd.",seed planter,Agricultural Equipment,9500.0
Agricultural Seeder 4 Rows Potato Planter with Fertilizer Seeder Agricultural Equipment,"Qingdao Hong Zhu Agricultural Machinery Co., Ltd",seed planter,Agricultural Equipment,2400.0
Cabbage Planter Cheap Radish Push Seeder for Sale Agricultural 5 Lines Machine,"Qingdao Henry Industry Co., Ltd.",seed planter,Agricultural Equipment,135.0
Advanced Farming Equipment Corn Seeder Precision Grain Crops Garlic Planter,"Shandong Gold Dafeng Machinery Co., Ltd.",seed planter,Agricultural Equipment,10000.0
Farming Equipment Agricultural Corn Seed Precision Planter Air-Sucking Soybean Planter,"Hebei Shuoxin Machinery Manufacturing Co., Ltd.",seed planter,Agricultural Equipment,500.0
Agricultural Equipment Seeder/No Till Seed Drill/Seed Planter,"Hebei Shuoxin Machinery Manufacturing Co., Ltd.",seed planter,Agricultural Equipment,500.0
Durable Pneumatic Corn Planter for Large-Scale Agricultural Use No-Tillage Corn Planter with Fertilize Function Soybean Sorghum,"HEBEI NONGHAHA AGRICULTURAL MACHINERY CO., LTD.
HEBEI NONGHAHA AGRICULTURAL MACHINERY CO., LTD.
Group Corporation
Diamond Member
Hebei, China
Audited Supplier
Sign In to see all verified strength labels (22)",seed planter,Agricultural Equipment,3415.0
20-80HP Tractor Potato Planting Machine Single-Row Potato Planter,"Yucheng Dingshengyuan Machinery Manufacturing Co., Ltd",seed planter,Agricultural Equipment,650.0
Compact Energy-Efficient User-Centric Vegetable Planter for Organic Gardens,"Jinan Xinyiyin Import and Export Trading Co., Ltd.",seed planter,Agricultural Equipment,300.0
Adaptable and Superior Sowing Quality Pneumatic Vegetable Planter of Onion,"Qingdao Dashun Jingfeng Industry and Trade Co., Ltd.",seed planter,Agricultural Equipment,5000.0
Factory Outlet Farm Machinery Precision Seed Drill Cost-Effective Farming Garlic Planter,"Shandong Gold Dafeng Machinery Co., Ltd.",seed planter,Agricultural Equipment,10000.0
Wholesale Reliable Portable Hand Push Corn Planter Beans Seeder Peanut Planter Maize Seeder Planting Machine,"Taizhou Weiyu Electromechanical Co., Ltd.",seed planter,Agricultural Equipment,45.0
Top-Notch Fertilizer Seed Pusher Double Barrel Corn-Rice Planter,"Taizhou Kesiwo Garden Tools Co., Ltd.",seed planter,Agricultural Equipment,37.0
High Precision Potato Seed Planter Machine 1 Row 2 Rows 4 Row Walking Tractor Potato Planter for Sale,"Shandong Tiansheng Machinery Science and Technology Co., Ltd.",seed planter,Agricultural Equipment,500.0
Farm Machinery Compact Small Vegetable Seed Planter Carrot Seeder Customized Wheat Rice Corn Seeder for Tractor for Sale,"Shandong Ling ke Industry Group Co., Ltd",seed planter,Agricultural Equipment,599.0
Corn Maize Soybean Tractor Precision Seed Planter,"Jiangsu Grande Machinery Manufacturing Co., Ltd.",seed planter,Agricultural Equipment,4670.0
Rotovator Small Field Cultivator Agriculture Product Seed Drill Threshing Machine Trailer Rotary Tiller Cylinder Roller,QINGDAO HANNSTAR TECHNOLOGY COMPANY LIMITED,seed planter,Agricultural Equipment,400.0
Yaao 2bmyfj-5 Series of Precision Corn Planter with Fertilizer Corn Seeder,"Xi'an Yaao Agricultural Machinery Co., Ltd.",seed planter,Agricultural Equipment,2985.3
Vegetable Seeder with Seeding Rollers /Carrot Onion Seed Planting Walking Vegetable Planter,"Zhengzhou Xiangkun Machinery Co., Ltd.",seed planter,Agricultural Equipment,2498.0
Factory Direct Sales Durable Corn Seeder Corn Planter with Tractor 4-12 HP Multi-Functional Corn Seeder Customizable Rows,"Jinan Xinyiyin Import and Export Trading Co., Ltd.",seed planter,Agricultural Equipment,300.0
Durable Manual Potato Planter for Sustainable Farming Needs,"Dezhou Hongyou Agricultural Machinery Co., Ltd",seed planter,Agricultural Equipment,3200.0
Farm Machinery Equipment Garden Tool Hand Push Vegetable Planter Manual Onion Seeder Planter,"Dezhou Lufa Machinery Co., Ltd",seed planter,Agricultural Equipment,130.0
High Sowing Efficiency and Stability Pneumatic Vegetable Planter of Onion,"Qingdao Dashun Jingfeng Industry and Trade Co., Ltd.",seed planter,Agricultural Equipment,12000.0
Seeder Manual Fertilizer Seeder/Walking Tractor Wheat Planter for Sale,"Qingdao Mingsin Trade Co., Ltd.",seed planter,Agricultural Equipment,149.0
Farm Machinery 3 Point Hitch Corn Planter / Corn Seed Planting Machine,"Jinan Alfing Machinery Co., Ltd.",seed planter,Agricultural Equipment,860.0
Agricultural Machinery Potato Planter,"Yucheng Dingshengyuan Machinery Manufacturing Co., Ltd",seed planter,Agricultural Equipment,650.0
Tractor Mounted 4 Rows Precision Corn Soybean Seed Planter,"YUCHENG HONGRI MACHINERY MANUFACTURE CO., LTD.",seed planter,Agricultural Equipment,1035.0
3 Point Hitch Soya Beans and Corn Seed Planter for Tractor,QINGDAO HANNSTAR TECHNOLOGY COMPANY LIMITED,seed planter,Agricultural Equipment,725.0
Tractor Coupled Four Row Potato Planter on Sale,"Shandong Ling ke Industry Group Co., Ltd",seed planter,Agricultural Equipment,599.0
Cost-Effective Robust Easy-to-Operate Vegetable Planter for Small Farms,"Jinan Xinyiyin Import and Export Trading Co., Ltd.",seed planter,Agricultural Equipment,300.0
Factory Wholesale 2 Ridge Potato Planter Working 4 Rows Seed Planter Suspension Tractor,"Qingdao Hong Zhu Agricultural Machinery Co., Ltd",seed planter,Agricultural Equipment,2400.0
China OEM Seed Drill Great Quality Corn Seeder Precision Agriculture Garlic Planter,"Shandong Gold Dafeng Machinery Co., Ltd.",seed planter,Agricultural Equipment,10000.0
Potato Seeder Machine Hand Push Vegetables Precision Planter,"Ningbo Tower Machinery Co., Ltd",seed planter,Agricultural Equipment,1000.0
Factory Direct Sale Standardized Vegetable Planter for Seeds Company,"Qingdao Dashun Jingfeng Industry and Trade Co., Ltd.",seed planter,Agricultural Equipment,5000.0
Brand New Potato Planting Equipment Potato Planter with Good Performance,"Shandong Star Agricultural Equipment Co., Ltd.",seed planter,Agricultural Equipment,2250.0
Wheat and Rice Seed Planter with 24 Rows,"YUCHENG MINGYUAN MACHINERY CO., LTD.
YUCHENG MINGYUAN MACHINERY CO., LTD.
Diamond Member
Audited Supplier
Shandong, China",seed planter,Agricultural Equipment,3500.0
New Agricultural Machinery Farming Tractor Hitched Single and Double Rows Potato Seed,"Shandong Tiansheng Machinery Science and Technology Co., Ltd.",seed planter,Agricultural Equipment,500.0
Farm Machinery Vegetable Seeding by Hand Precision Drill Seed Planter,"Qingdao Detongda International Trading Co., Ltd.",seed planter,Agricultural Equipment,80.0
High-Precision Mechanical Corn Planter for Optimal Seed Placement,"Shandong Platinum Dylan Machinery Co., Ltd.",seed planter,Agricultural Equipment,413.0
Automatic Potato Planter Machine Price 2 Rows Potato Seeder Planter,"Shandong Ling ke Industry Group Co., Ltd",seed planter,Agricultural Equipment,599.0
Save Time and Effort Hand Push Vegetable Planter on Sale,"Yucheng Zeyi Machinery Co., Ltd.",seed planter,Agricultural Equipment,196.0
Corn Planter for 2 Wheeled Walking Tractor 15HP Power Tiller,"Shan Dong Chang Mei Trading Co., Ltd.",seed planter,Agricultural Equipment,85.0
Multi Row Planters for Agricultural Machinery,"Sinomach-Hi International Equipment Co., Ltd.",seed planter,Agricultural Equipment,9805.0
Multi-Functional Durable Peanut Planter with Fertilizer Application for Enhanced Yield,"Jinan Xinyiyin Import and Export Trading Co., Ltd.",seed planter,Agricultural Equipment,300.0
Potato Planter 2 Row Corn Planter,"Yucheng Dingshengyuan Machinery Manufacturing Co., Ltd",seed planter,Agricultural Equipment,650.0
36.7 - 58.8 Kw Tractor Potato Planter with Fertilizer 2 Rows Potato Planter,"Qingdao Hong Zhu Agricultural Machinery Co., Ltd",seed planter,Agricultural Equipment,2400.0
Agricultural Machinery Multi Row Planters,"Sinomach-Hi International Equipment Co., Ltd.",seed planter,Agricultural Equipment,9805.0
Easy and Efficient Seeder Precise Pneumatic Planter for Farm,"Qingdao Dashun Jingfeng Industry and Trade Co., Ltd.",seed planter,Agricultural Equipment,4000.0
Farm Tract Pto Two Row Potato Planter Machine Poulty Farming Equipment China Supplier,"Qingdao Hong Zhu Agricultural Machinery Co., Ltd",seed planter,Agricultural Equipment,2400.0
2bf-24 High-Efficiency Multi-Functional Grain Precision Planter for Various Crops,"Shandong New Camel Union International Co., LTD",seed planter,Agricultural Equipment,7500.0
Hot Sale Customizable Agricultural Equipment Corn Seeder Planter with Farm Tractor,"Jinan Xinyiyin Import and Export Trading Co., Ltd.",seed planter,Agricultural Equipment,300.0
New Design Double Rows Multifunctional Flat Equipment Potato Planter,"Shandong Star Agricultural Equipment Co., Ltd.",seed planter,Agricultural Equipment,2250.0
Yaao 2bfg-18 (9) (230) Wheat and Corn Planter Variable Speed Rotary Sowing Fertilizer Spreader,"Xi'an Yaao Agricultural Machinery Co., Ltd.",seed planter,Agricultural Equipment,4121.2
2025 New Model Versatile Potato Planter Tool for Quick and Easy Planting 2zmx-2,"Dezhou Hongyou Agricultural Machinery Co., Ltd",seed planter,Agricultural Equipment,3200.0
Vegetable Carrot Planter Green Onion Vegetable and Onion Planter Factory Direct Sales,"Yucheng Dingshengyuan Machinery Manufacturing Co., Ltd",seed planter,Agricultural Equipment,980.0
Manufacturers Sell Sweet Potatoes Potato Planter for Tractor,"Zhengzhou Runxiang Machinery Equipment Co., Ltd.",seed planter,Agricultural Equipment,668.0
Continuous and Stable Sowing Operations Pneumatic Vegetable Planter of Onion,"Qingdao Dashun Jingfeng Industry and Trade Co., Ltd.",seed planter,Agricultural Equipment,5000.0
Brand New Farm Equipment Potato Seedling Machine Potato Planter,"Shandong Star Agricultural Equipment Co., Ltd.",seed planter,Agricultural Equipment,2250.0
Corn Planter,"Yucheng Dingshengyuan Machinery Manufacturing Co., Ltd",seed planter,Agricultural Equipment,650.0
China Supplier Tractor Mounted 4 Row High Accurate Potato Planter Other Agricultural Machinery &,"Qingdao Hong Zhu Agricultural Machinery Co., Ltd",seed planter,Agricultural Equipment,2400.0
Eco-Conscious Low-Noise Energy-Efficient Potato Planter for Agricultural Farming,"Jinan Xinyiyin Import and Export Trading Co., Ltd.",seed planter,Agricultural Equipment,300.0
Customized Corn Seeder Pneumatic Precision Corn Planter for Optimal Seed Distribution,"Shandong Gold Dafeng Machinery Co., Ltd.",seed planter,Agricultural Equipment,10000.0
Farm Machinery Tractor 6 Rows Corn Planter Machine Corn Seed Planter,"Qingdao Mingsin Trade Co., Ltd.",seed planter,Agricultural Equipment,60.0
OEM Agricultural Machinery Tractor Three with Three Point Linkage Corn Planter No-Tillage Corn with Fertilize Function Soybean Sorghum,"HEBEI NONGHAHA AGRICULTURAL MACHINERY CO., LTD.",seed planter,Agricultural Equipment,3415.0
4 Wheel Tractor Agriculture Machinery Equipment One Row Potato Planter,"Qingdao Detongda International Trading Co., Ltd.
Qingdao Detongda International Trading Co., Ltd.
Diamond Member
Audited Supplier
Shandong, China",seed planter,Agricultural Equipment,600.0
Agricultural Machinery Tractor Maize Seeder Corn Planter for Sale Planter,"YUCHENG HONGRI MACHINERY MANUFACTURE CO., LTD.",seed planter,Agricultural Equipment,399.0
China Factory Made Potato Planter Automatic Potato Planter Machine Price 2 Rows Potato Seeder,"Yucheng Dingshengyuan Machinery Manufacturing Co., Ltd",seed planter,Agricultural Equipment,650.0
"Convenient, Fully Automatic and High Efficiency Pneumatic Planter for Farm","Qingdao Dashun Jingfeng Industry and Trade Co., Ltd.",seed planter,Agricultural Equipment,3500.0
Yaao 2byf-4 (250) Corn Seeder and Maize Planter for Agriculture,"Xi'an Yaao Agricultural Machinery Co., Ltd.",seed planter,Agricultural Equipment,4424.3
China Small Tractor Corn Seed Planter Maize Planting Machine 6-Row Corn Planter,QINGDAO HANNSTAR TECHNOLOGY COMPANY LIMITED,seed planter,Agricultural Equipment,725.0
111highly Adaptable Seed Drill Farm Machinery Pneumatic Precision Corn Planters for Wheat,"Shandong Gold Dafeng Machinery Co., Ltd.",seed planter,Agricultural Equipment,10000.0
Agriculture Equipment Tools Garlic Seeds Precise No Till Air Suction Seed Planter,"Jianhu Lucky Gold Trading Co., Ltd.",seed planter,Agricultural Equipment,9599.0
Garlic Grass Machine Agricultural Machinery Equipment Sunflower Grain Seeder Seed Planter,"Shandong Kunhong Supply Chain Management Co., Ltd.",seed planter,Agricultural Equipment,36.0
Four Rows Five Rows Six Rows Corn Planter Customizable Rows CE Certification Automatic Owing Depth Adjustment Corn Planting Machine Maize Seeder,"Jinan Xinyiyin Import and Export Trading Co., Ltd.",seed planter,Agricultural Equipment,300.0
Factory Price Farm Machinery Advanced Seed Drill Garlic Corn Planter,"Shandong Gold Dafeng Machinery Co., Ltd.",seed planter,Agricultural Equipment,10000.0
Fully Functional and Reasonable Structure Pneumatic Vegetable Planter of Onion,"Qingdao Dashun Jingfeng Industry and Trade Co., Ltd.",seed planter,Agricultural Equipment,5000.0
New Farm Machinery Implement 2 Row Tractor Potato Planting Machine Potato Planter with Fertilizer,"Yucheng Dingshengyuan Machinery Manufacturing Co., Ltd",seed planter,Agricultural Equipment,650.0
Reliable Corn Planter and Seeder Machine with High Efficiency Design,"Shandong King Machinery Co., Ltd.",seed planter,Agricultural Equipment,20000.0
Factory Price Corn Planter for Rice Soybeans Sorghum with CE Certification,"Shandong Gold Dafeng Machinery Co., Ltd.",seed planter,Agricultural Equipment,10000.0
Advanced 2025 Pneumatic Precision Corn Planters for Efficient Farming,"HEBEI NONGHAHA AGRICULTURAL MACHINERY CO., LTD.",seed planter,Agricultural Equipment,7186.0
Green Corn Seeder Planter by Maschio with Casting Metal Configuration,"XINGTAI VOKIN RUBBER & PLASTIC PRODUCTS CO., LTD.",seed planter,Agricultural Equipment,1170.0
Flexible Durable Space-Saving Potato Planter for Agricultural Farming Use,"Jinan Xinyiyin Import and Export Trading Co., Ltd.",seed planter,Agricultural Equipment,300.0
High Sowing Accuracy and Stable Sowing Operations Pneumatic Vegetable Planter of Onion,"Qingdao Dashun Jingfeng Industry and Trade Co., Ltd.",seed planter,Agricultural Equipment,12000.0
3 Point Potato Planter Machine Agricultural Equipment 4 Rows Sweet Potato Seeder,"Qingdao Hong Zhu Agricultural Machinery Co., Ltd",seed planter,Agricultural Equipment,2400.0
Agriculture Wheat Seeder 24 Row Wheat Planter with Tire,"Yucheng Hengshing Machinery Co., Ltd.",seed planter,Agricultural Equipment,2200.0
Agricultural Fields Vegetable Planter Machinery Manufacture Factory Direct Selling,"Jinan Xinyiyin Import and Export Trading Co., Ltd.",seed planter,Agricultural Equipment,10000.0
Comfortable and Strong Sowing Uniformity Pneumatic Vegetable Planter of Onion,"Qingdao Dashun Jingfeng Industry and Trade Co., Ltd.",seed planter,Agricultural Equipment,5000.0
Wholesale Affordable High-Capacity Wheat Planter for Commercial Grain Production,"Jinan Xinyiyin Import and Export Trading Co., Ltd.",seed planter,Agricultural Equipment,300.0
Agricultural Farm Use Wholesale Planting Potatoes Tractor Mounted Potato Planter,"Qingdao Hong Zhu Agricultural Machinery Co., Ltd",seed planter,Agricultural Equipment,2400.0
Farm Machinery Hot Sale Single Row Maize Cabbage Bean Spinach Watermelon Sunflower Portable Manual Seeding,"Sinomach-Hi International Equipment Co., Ltd.",seed planter,Agricultural Equipment,11344.0
Potato Planter Supply Double Row Planter 2cm -4 Tractor Potato Planter,"Yucheng Dingshengyuan Machinery Manufacturing Co., Ltd",seed planter,Agricultural Equipment,650.0
Hot Sale Tractor Machine 3 Point Two Row Potato Planter Seed Seeding Machine Mounted with Tractor,"Qingdao Hong Zhu Agricultural Machinery Co., Ltd",seed planter,Agricultural Equipment,2400.0
Agricultural Machinery Multi Row Planters Seedling,"Sinomach-Hi International Equipment Co., Ltd.
Sinomach-Hi International Equipment Co., Ltd.
Diamond Member
Shanghai, China
Audited Supplier
High Repeat Buyers Choice
Years of Export Experience
Sign In to see all verified strength labels (21)",seed planter,Agricultural Equipment,9805.0
Compact High-Efficiency Potato Planter Ideal for Small Gardens 2zmx-2,"Dezhou Hongyou Agricultural Machinery Co., Ltd",seed planter,Agricultural Equipment,3200.0
Lightweight and Flexible Pneumatic Vegetable Planter of Onion,"Qingdao Dashun Jingfeng Industry and Trade Co., Ltd.",seed planter,Agricultural Equipment,12000.0
New Design Agricultural Machinery Farm Tractor Garlic Planting Seeder Planter,"Jinan Xinyiyin Import and Export Trading Co., Ltd.",seed planter,Agricultural Equipment,300.0
Hongyou Farm Machinery Potato Planting Machine Multiple Rows Potato Planter for Sale 2cm-2A,"Dezhou Hongyou Agricultural Machinery Co., Ltd",seed planter,Agricultural Equipment,1600.0
Agricultural Machinery Equipment Push Sunflower Grain & Transplanters Seeder Machine Planter,"Linyi Fengrui Plant Protection Electronic Equipment Co., Ltd.",seed planter,Agricultural Equipment,35.0
Tractor Mounted Potato Planter 3 Point Linkage Double Row Potato Planter with Fertilizer,"Qingdao Hong Zhu Agricultural Machinery Co., Ltd",seed planter,Agricultural Equipment,2400.0
Operate The User-Friendly and Consistent Seed Spacing Pneumatic Vegetable Planter of Onion,"Qingdao Dashun Jingfeng Industry and Trade Co., Ltd.",seed planter,Agricultural Equipment,5000.0
Anon 2020 Factory Vegetable Seed Planter Carrot Onion Tomato Alfalfa Planter with Best Quality,"Wuhan Anon Tech-Trade Co., Ltd.",seed planter,Agricultural Equipment,139.0
Potato Seeder 3 Point Potato Planter Machine Manufacturer Potato Planter for 2 Wheel Tractor,"Yucheng Dingshengyuan Machinery Manufacturing Co., Ltd",seed planter,Agricultural Equipment,650.0
"Home/Farm Wheat Planter, Quick and Easy to Operate","Qingdao Mingsin Trade Co., Ltd.",seed planter,Agricultural Equipment,149.0
Hot Sale Cheap Price Paddy Rice Seed Planter Seeder Machine Transplanter Price 6 Row 238 mm Planting,"Shandong Weito Import & Export Co., Ltd.",seed planter,Agricultural Equipment,870.0
Yaao 2byf-4 (250) Seeding Machine Seeder Corn Precision Fertilizer Planter,"Xi'an Yaao Agricultural Machinery Co., Ltd.",seed planter,Agricultural Equipment,4424.3
Customized Pneumatic Precision Corn Planter for 24-Line Air Volume with CE Certification,"Shandong Gold Dafeng Machinery Co., Ltd.",seed planter,Agricultural Equipment,10000.0
High-Capacity Advanced Peanut Planter with Wide Coverage for Large Farms,"Jinan Xinyiyin Import and Export Trading Co., Ltd.",seed planter,Agricultural Equipment,300.0
Stable Performance and High Quality Pneumatic Vegetable Planter of Onion,"Qingdao Dashun Jingfeng Industry and Trade Co., Ltd.",seed planter,Agricultural Equipment,5000.0
Pneumatic Conventional Arable Land Corn Seeder Precision Corn Garlic Planter,"Shandong Gold Dafeng Machinery Co., Ltd.",seed planter,Agricultural Equipment,10000.0
Easy Operated Peanut Planter with Advanced Features for Precision Farming,"Jinan Xinyiyin Import and Export Trading Co., Ltd.",seed planter,Agricultural Equipment,300.0
Wheat Seeder /Planter 24 Row,"Xuzhou Zhongyang Agri Machinery Co., Ltd.",seed planter,Agricultural Equipment,5000.0
Factory Direct Modernization Seed Drill Enhanced Durability Pneumatic Precision Corn Planter,"Shandong Gold Dafeng Machinery Co., Ltd.",seed planter,Agricultural Equipment,10000.0
ODM High-Efficiency Corn Seeder Pneumatic Precision Corn Planter for Sustainable Agriculture,"Shandong Gold Dafeng Machinery Co., Ltd.",seed planter,Agricultural Equipment,10000.0
Tractor Dragged Pto Two Row Potato Garlic Planter Double Row Potato Planting Machine Garlic Planter for Sale,"Qingdao Hong Zhu Agricultural Machinery Co., Ltd",seed planter,Agricultural Equipment,2400.0
Pneumatic Precision Planters for Efficient Large-Scale Agricultural Use,"HEBEI NONGHAHA AGRICULTURAL MACHINERY CO., LTD.",seed planter,Agricultural Equipment,7186.0
Highly Efficient and Energy-Saving Pneumatic Vegetable Planter of Onion,"Qingdao Dashun Jingfeng Industry and Trade Co., Ltd.",seed planter,Agricultural Equipment,5000.0
Flexible Durable Space-Saving Vegetable Planter for Urban Farming,"Jinan Xinyiyin Import and Export Trading Co., Ltd.",seed planter,Agricultural Equipment,300.0
Agricultural Machinery Vegetable Seeder Seeding Machine Pneumatic Planter,"Qingdao Dashun Jingfeng Industry and Trade Co., Ltd.",seed planter,Agricultural Equipment,5000.0
Vegetable Seed Planter Carrot Onion Garlic Tomato Alfalfa Planter with Best Quality,"Jinan Xinyiyin Import and Export Trading Co., Ltd.",seed planter,Agricultural Equipment,300.0
Farm Potato Planter Supply Double Row Planter 2cm -4 Tractor Potato Planter,"Yucheng Dingshengyuan Machinery Manufacturing Co., Ltd",seed planter,Agricultural Equipment,650.0
Customized Pneumatic Precision Corn Planter for Universal Transmission Shaft with CE Certification,"Shandong Gold Dafeng Machinery Co., Ltd.
Shandong Gold Dafeng Machinery Co., Ltd.
Manufacturer/Factory & Trading Company
Diamond Member
Shandong, China
Audited Supplier
High Repeat Buyers Choice
Importers and Exporters
Years of Export Experience
Patents Awarded
Sign In to see all verified strength labels (31)",seed planter,Agricultural Equipment,10000.0
Customized Pneumatic Precision Corn Planter for Advanced Farming Solutions with CE Certification,"Shandong Gold Dafeng Machinery Co., Ltd.",seed planter,Agricultural Equipment,10000.0
High Quality Potato Seed Planter for 4 Rows Precision Seeder Manual for Farm Planting with Wholesale Price,"Qingdao Hong Zhu Agricultural Machinery Co., Ltd",seed planter,Agricultural Equipment,2400.0
Agriculture Farm Machinery Walking Tractor Single-Row Potato Planter,"Ningbo Tower Machinery Co., Ltd",seed planter,Agricultural Equipment,1000.0
Energy-Saving and Environmentally Friendly Pneumatic Vegetable Planter of Onion,"Qingdao Dashun Jingfeng Industry and Trade Co., Ltd.",seed planter,Agricultural Equipment,5000.0
Superior Fertilizer Seed Pusher Double Barrel Corn-Rice Planter,"Taizhou Kesiwo Garden Tools Co., Ltd.",seed planter,Agricultural Equipment,37.0
