Product Name,Company Name,Product Type,Category,Cleaned Price
Professional Farm Drone Kit 30L All-Terrain Plant Protection Agricultural Orchard Corn Spraying Irrigation Uav for Farm Use,"Nanjing Hongfei Aviation Technology Co., Ltd.",drone,Agricultural Equipment,6710.0
Newly-Designed 10kg Pesticide Agricultural Drones Spraying Machine for Agriculture Similar as Dji T10,"Shandong Joyance Intelligence Technology Co., Ltd.",drone,Agricultural Equipment,2999.0
16 Liters Drone Duster Mist Uav Sprayers Agriculture Machinery Equipment Drones for Fumigation,"Shandong Joyance Intelligence Technology Co., Ltd.",drone,Agricultural Equipment,3999.0
72L Payload Long Range Agricultural Drone Uav Sprayer 8 Motors RC Farm Crop Equipment Agri Agro Purpose with Camera&GPS for Chemical Spraying,"Nanjing Hongfei Aviation Technology Co., Ltd.",drone,Agricultural Equipment,15445.0
Crop Spraying 30L Drone Agricultural Machinery for Agriculture Farm Spray with Fertilizer Seed Spreader,"Nanjing Zhixingfei Technology Co., Ltd.",drone,Agricultural Equipment,6714.0
Agr 10 20 30 40 Liters Spraying Machines for Agriculture Purpose Drone Farming Equipment for Fumigation,"Shandong Joyance Intelligence Technology Co., Ltd.",drone,Agricultural Equipment,8800.0
30 50 Liters Uav Sprayer Field Fruit Crop Pesticide Chemical Agricultural Spraying Drone Machine for Sale with Fertilizer Seed Farm Spreading,"Nanjing Zhixingfei Technology Co., Ltd.",drone,Agricultural Equipment,7252.0
Real-Time Calibration Drone Technology in Agriculture 52L Agricultural Crops Plane Machinery Farm Spraying Fertilizer Using,"Nanjing Hongfei Aviation Technology Co., Ltd.",drone,Agricultural Equipment,10590.0
Joyance Agricultral Sprayer Drone Uav Agricultural Drone Machinery for Spraying Pesticide,"Shandong Joyance Intelligence Technology Co., Ltd.",drone,Agricultural Equipment,8999.0
Multi-Function Fertilizer Application Drone 60L Payload Farm Uav Agricultural Drone Crop Spraying for Agriculture Purpose,"Nanjing Hongfei Aviation Technology Co., Ltd.",drone,Agricultural Equipment,30065.0
Intelligence Drone for Agriculture 20L Remote Control Agricultural Farm Machine Crop Spraying for Topographical Work,"Nanjing Hongfei Aviation Technology Co., Ltd.",drone,Agricultural Equipment,3845.0
Agricultural Sprayers Drone Uav 8-Axis 72L Loading Plant Protection Rice Spreader Machine IP67 Waterproof Electric Agriculture Spraying with Night Flight,"Nanjing Hongfei Aviation Technology Co., Ltd.",drone,Agricultural Equipment,15445.0
Easy to Operate Agriculture Drone Paddy Planter Rice Seeder Seeding Planting Machine,"Nanjing Zhixingfei Technology Co., Ltd.",drone,Agricultural Equipment,7252.0
Frame Drone Machine for Agriculture with Rice Crop Spreader 30L Agricultural Sprayers Assemble Pest Control,"Nanjing Hongfei Aviation Technology Co., Ltd.",drone,Agricultural Equipment,925.0
22L Powerful Folding Agricultural Sprayer Uav 4-Axis Crop Duster Equipment Agricultural Remote Control Uav for Spraying Pesticides Can Fly Autonomously,"Shandong Aolan Drone Science and Technology Co., Ltd.",drone,Agricultural Equipment,4200.0
72L IP67 Washable Portable Professional Uav Long Distance Agricultural Fumigation Machine Drone with Rice Spreader Kit for Agriculture Fertilizer Spraying,"Nanjing Hongfei Aviation Technology Co., Ltd.",drone,Agricultural Equipment,15445.0
Large-Scale Agricultural Irrigation Farm Drone Rice Spreader Uav 30L Agriculture Pesticide Control Machine Spraying,"Nanjing Hongfei Aviation Technology Co., Ltd.",drone,Agricultural Equipment,6210.0
Brazil Automatic Equipment Used in Farms 4K Drone RC Helicopter Hybrid Fast Battery Power Crop Uav Sprayer,"Xuzhou Jitian Intelligent Equipment Co., Ltd.",drone,Agricultural Equipment,6500.0
Easy to Assemble 10 Liters Farm Drone Battery Power Pesticide Sprayer Tta Brand Agricultural Machinery,"Beijing TT Aviation Technology Co., Ltd.",drone,Agricultural Equipment,5699.0
Wholesale 52L Payload Agriculture Pesticide Fumigacion Drone Equipment Agricultural Remote Control Electric Garden Sprayer 60kg Payload Farm Spray Uav Price,"Nanjing Zhixingfei Technology Co., Ltd.",drone,Agricultural Equipment,10588.0
Farm Tools and Equipment Agricultural Power Sprayer/Pesticide Spray Machine Uav,"Xuzhou Jitian Intelligent Equipment Co., Ltd.",drone,Agricultural Equipment,8600.0
Easy Transportation Drone Sprayer Agricultural Spray Machine,"Beijing TT Aviation Technology Co., Ltd.",drone,Agricultural Equipment,7999.0
Long Durable Flying Agricultural Sprayer Equipment/Uav,"Xuzhou Jitian Intelligent Equipment Co., Ltd.",drone,Agricultural Equipment,8400.0
Factory Heavy Drone Sprayer Agricultural Spraying Remote Control Flight Machine,"Beijing TT Aviation Technology Co., Ltd.",drone,Agricultural Equipment,3999.0
Folding Agricultural Drone Sprayer Rice Spreader Uav 30L Precision Automatic Spray Machine Disinfection Fumigation Agriculture Spraying with Camera,"Nanjing Hongfei Aviation Technology Co., Ltd.",drone,Agricultural Equipment,6210.0
Unid Profession Agricultural Pesticides Spray Equipment Drone with GPS Drone Farming Agriculture Larger Load and Higher Efficiency Sprayer 2023,"Heilongjiang Huida Technology Co., Ltd.",drone,Agricultural Equipment,8980.0
New Technology Drone Farming Agriculture Spray Agriculture Pesticides Machine Farm Machinery,"Heilongjiang Huida Technology Co., Ltd.",drone,Agricultural Equipment,8980.0
Good Service Self-Propelled Agriculture Boom Drone Pressure Self Propelled Spraye,"Qingzhou Vertex Agricultural Equipment Co., Ltd.",drone,Agricultural Equipment,3000.0
"20kg Load Carrying Drone Can Be Equipped with Various Transportation, Agriculture, Firefighting and Irrigation","Zhuhai Kunhang Intelligent Technology Co., Ltd.",drone,Agricultural Equipment,4378.0
Control Pest Spraying Machine Drone for Agricultural Fumigation Farming Equipment,"Heilongjiang Huida Technology Co., Ltd.",drone,Agricultural Equipment,5200.0
Agricultural Spray Drone for Agricultur Sprayer for Farm 200 Liter,"Guohaha Agricultural Machinery (Shandong) Co., Ltd.",drone,Agricultural Equipment,1150.0
Spraying Efficiency of 325 Mu/H Sowing and Spreading All-in-One Drone Unid Profession Pesticides Spray with GPS Camera 2023,"Heilongjiang Huida Technology Co., Ltd.",drone,Agricultural Equipment,8980.0
Mountain Area Agricultural Drone Pesticide Spraying Machine Irrigation Equipment Agriculture in India,"Heilongjiang Huida Technology Co., Ltd.",drone,Agricultural Equipment,8980.0
Agricultural Drone Farming Machinery Equipment AG Spraying Drone Crop Spraying by Drone,"Heilongjiang Huida Technology Co., Ltd.",drone,Agricultural Equipment,8980.0
Agriculture Pesticide Crop Drone 100-400kg Heavy Payload Agricola Drone,"Chongqing Lehman Automobile Service Co., Ltd.",drone,Agricultural Equipment,500000.0
Wholesale Fpv Aircraft Multicopter Drone Accessories Drone Frame,"Zhuhai Kunhang Intelligent Technology Co., Ltd.",drone,Agricultural Equipment,70.0
"80m 120 Degree Agricultural Drone Collision Avoidance Sensing Radar System, Support Ardupilot Platform",Novasky Technology Company Limited by Shares,drone,Agricultural Equipment,78.0
Rapid Prototype Serivce for Agriculture Camera Agricultural Spray Drone Quadcopter Drone New Unmanned Aerial Vehicle Design,"Xiamen Ballgarii General Equipment Co., Ltd.",drone,Agricultural Equipment,1.0
55L Payload Agriculture Autonomous Flying Sprayer Drone for Big Farm,"Chongqing Lehman Automobile Service Co., Ltd.",drone,Agricultural Equipment,500000.0
Wholesale Customizable Transport Drone Framework,"Zhuhai Kunhang Intelligent Technology Co., Ltd.",drone,Agricultural Equipment,60.0
Factory Wholesale 35L 50L 55L 80L Fumigation Fertilizer Agricultural Drone Agriculture Sprayer,"Qingdao Zhongfei Intelligent Technology Co., Ltd.
Qingdao Zhongfei Intelligent Technology Co., Ltd.
Diamond Member
Audited Supplier
Shandong, China
Manufacturer/Factory & Trading Company",drone,Agricultural Equipment,7000.0
Hot Sale 8 Rotor Gyroplane Spraying Uav Agriculture Uav Crop Drone Agri Machinery,"Beijing TT Aviation Technology Co., Ltd.",drone,Agricultural Equipment,7999.0
Certified Pre-Owned Agricultural Drones & Accessories Save 50% + Global Shipping,"Shandong Xinwotian Machinery Parts Co., Ltd",drone,Agricultural Equipment,1500.0
Plant Protection Drone Special Hot Selling Uav Long Range Spray Agricultural Drone Agricola,"Shandong Aolan Drone Science and Technology Co., Ltd.",drone,Agricultural Equipment,5200.0
Drone Data Link Supplier Radio Communication Definition Transmitter Radio Repeater Wave Radio Relay Network Wave Wireless Portal Radios Definition Receiver,"Shenzhen Xingkai Technology Co., Ltd",drone,Agricultural Equipment,2572.0
Powerful 3wp-1300 Agricultural Drone for Precision Pesticide Application,"JILIN YAODA MACHINERY EQUIPMENT CO., LTD.",drone,Agricultural Equipment,5000.0
4 Axis Agriculture Drone GPS Flying Automatically Agricultural Sprayer Drone with Camera Radar,"Shandong Aolan Drone Science and Technology Co., Ltd.",drone,Agricultural Equipment,5200.0
Farm Drone Sprayer Agriculture Sprayer Fumigation Pumps Provided Farm Equipment Irrigation Pump Spray Pump,"Beijing TT Aviation Technology Co., Ltd.",drone,Agricultural Equipment,8999.0
50kg Big Payload Drone Sprayer Long Flying Time Agricultural Uav Drone Sprayer for Plant Protection,"Shandong Joyance Intelligence Technology Co., Ltd.",drone,Agricultural Equipment,11000.0
High Accuracy Dron De Fumigacion Agricola 35L Rice Spreader Uav Drone Farming Machinery T40 GPS Agriculture Powered Engine Spraying for Crop Orchard,"Nanjing Hongfei Aviation Technology Co., Ltd.",drone,Agricultural Equipment,11770.0
Quadcopter Drone Factory Vtol Drone Uavs Deploy Gopro Drone Survey Equipment Remote Control Fpv,"Shenzhen Xingkai Technology Co., Ltd",drone,Agricultural Equipment,455.0
High-Performance Mapping Drone with One-Key Return for Easy Navigation,"Ruiyuan Holdings Group International Trade Co., Ltd.",drone,Agricultural Equipment,40.0
Fumigation Fogger Drone Agriculture Drone Sprayer Machines Agriculture Autopilote RC Drone,"Shandong Aolan Drone Science and Technology Co., Ltd.",drone,Agricultural Equipment,5200.0
Best Matchenvironmental Protection Pesticide Spraying Drone Plant Protection,"Shanghai Genyond Technology Co., Ltd.",drone,Agricultural Equipment,8000.0
Professional 16 Litre 22 Litre Sprayer Drone Agricultural Spraying Drones,QINGDAO HANNSTAR TECHNOLOGY COMPANY LIMITED,drone,Agricultural Equipment,2800.0
China Reliable Agricultural Crop Uav Drones with Camera and GPS for Pesticide Spraying,"Shandong Joyance Intelligence Technology Co., Ltd.",drone,Agricultural Equipment,2999.0
Portable RC Helicopter Drone with One-Key Return for Long-Range Flying,"Ruiyuan Holdings Group International Trade Co., Ltd.",drone,Agricultural Equipment,40.0
10kg Foldable Agriculture Uav Drone Spraying,"Shanghai Genyond Technology Co., Ltd.",drone,Agricultural Equipment,9000.0
Agriculture Pesticide Spraying Uav Drones Crop Sprayer Drone Parts,"Qingdao Zhongfei Intelligent Technology Co., Ltd.",drone,Agricultural Equipment,8000.0
Crops Spraying Agricultural Machinery High Spraying Effective Large 40L Agricultural Drones,"Shandong Joyance Intelligence Technology Co., Ltd.",drone,Agricultural Equipment,8999.0
Chinese-Made Helicopter Drone Precision Crop Spraying Machine,"Beijing TT Aviation Technology Co., Ltd.",drone,Agricultural Equipment,6399.0
Crop Pesticide Sprayer Drone Dustproof Uav Waterproof Agricultural Sprayer Aircraft for Plant Protection for Farming,"Shandong Aolan Drone Science and Technology Co., Ltd.",drone,Agricultural Equipment,5200.0
Drone Pesticide Sprayer Price Pesticide Spraying Machinery Machinery and Equipments,"Beijing TT Aviation Technology Co., Ltd.",drone,Agricultural Equipment,6399.0
Agriculture Seeding Drone Agricultural Uav Drone Centrifugal Nozzle Suitable Agro Drone Uav,"Shandong Aolan Drone Science and Technology Co., Ltd.",drone,Agricultural Equipment,5200.0
30 L Agricultural Uav High Efficiency Farm Drone Pesticide Agriculture Farm Drone Pesticide Agriculture Sprayer,"Beijing TT Aviation Technology Co., Ltd.",drone,Agricultural Equipment,8999.0
4-Axis A30 Agricultural Drone Sprayer Camera Uav Farm Crop Spraying Drone Fumigation Drone,"Shandong Aolan Drone Science and Technology Co., Ltd.",drone,Agricultural Equipment,4700.0
Venta De Drones PARA Fumigar En Mexico Spraying Autonomous Rice Paddy Wheat Corn Farming Price Pesticides Machine with Sprayer Cost Price,"Nanjing Zhixingfei Technology Co., Ltd.",drone,Agricultural Equipment,7252.0
Uav Sprayers Agriculture Machinery Equipment Drone Spraying,"Xuzhou Jitian Intelligent Equipment Co., Ltd.",drone,Agricultural Equipment,8400.0
Tta 30L Durable Long Range Automatic Drone Agriculture Sprayer Agriculture Drone Long Range,"Beijing TT Aviation Technology Co., Ltd.",drone,Agricultural Equipment,8999.0
Advanced 10kg Drone for Efficient Agricultural Fumigation Solutions Versatile 10kg Agricultural for Precision Spraying and Fumigation,"Shenzhen Shangyi Jinggong Technology Co., Ltd.",drone,Agricultural Equipment,480.0
A30 Agricultural Electric Sprayer Drone Sprayer Professional GPS Uav Drone Fumigations Uav Sprayer,"Shandong Aolan Drone Science and Technology Co., Ltd.
Shandong Aolan Drone Science and Technology Co., Ltd.
Manufacturer/Factory & Trading Company
Diamond Member
Shandong, China
Audited Supplier
High Repeat Buyers Choice
Fast Delivery
Standardized quality control
OEM Services
Sign In to see all verified strength labels (23)",drone,Agricultural Equipment,5200.0
Formidable Foldable Farm Crop Equipment Agriculturaldistant Control Drones for Crop-Dusting,"Beijing TT Aviation Technology Co., Ltd.",drone,Agricultural Equipment,8999.0
Advanced Agricultural Drone with 30 Liters Capacity for Spraying,"Shandong Aolan Drone Science and Technology Co., Ltd.",drone,Agricultural Equipment,5200.0
Helicopter Drone Precision Crop Spraying Machine Made in China,"Beijing TT Aviation Technology Co., Ltd.",drone,Agricultural Equipment,6399.0
Versatile Agricultural Drone Designed for Large-Scale Crop Spraying,"Shandong Aolan Drone Science and Technology Co., Ltd.",drone,Agricultural Equipment,5200.0
10kg/15kg/ 16kg/20kg Agriculture Sprayer Water Pump in Agriculture Pesticides Spraying Drone,"SDLANCH (Shandong) Intelligent Technology Co., Ltd.",drone,Agricultural Equipment,7089.0
Portable RC Helicopter Drone for Easy Flying and High-Performance Mapping,"Ruiyuan Holdings Group International Trade Co., Ltd.",drone,Agricultural Equipment,40.0
Agriculture Nozzle Drone Sprayer Equipments for Mango Garden,"Xuzhou Jitian Intelligent Equipment Co., Ltd.",drone,Agricultural Equipment,8400.0
Agr Farming Machinery Equipment Full Terrain AG Spraying Drone Crop Spraying by Drone,"Beijing TT Aviation Technology Co., Ltd.",drone,Agricultural Equipment,7999.0
Precision Agriculture Spraying Pesticide Uav Drones,"Shanghai Genyond Technology Co., Ltd.",drone,Agricultural Equipment,10000.0
Mavic 3 Enterprise Uav (3E) Specialized Night Vision Equipment and Thermal Imaging Drone,"Guangzhou Shangyang Trading Co., Ltd.",drone,Agricultural Equipment,2799.0
Uav Surveillance System CCTV Camera Aircraft Drone Dji Use for Personal Use/Agriculture/Industry/Engineering Projects,"Veacam Electronics Co., Ltd",drone,Agricultural Equipment,6799.0
Spraying Liquid Chemical Pesitcides Uav Agriculture Drone 16L 22L 30L,QINGDAO HANNSTAR TECHNOLOGY COMPANY LIMITED,drone,Agricultural Equipment,2800.0
Manufacturer Wholesale Agricultural Farming Purpose A20 Sprayer Drone for Autonomous Chemical,"Shandong Aolan Drone Science and Technology Co., Ltd.",drone,Agricultural Equipment,5200.0
China Factory Supplying Agricultural Sprayers Payload Delivery Drone,"Qingdao Zhongfei Intelligent Technology Co., Ltd.",drone,Agricultural Equipment,11000.0
High Quality Uav Machinery Equipment Manufacturer Crop Spraying Automatic Uav,"Beijing TT Aviation Technology Co., Ltd.",drone,Agricultural Equipment,6399.0
Functional Agricola Uav A30L New Farm Sprayer Frame Agriculture Uav Sprayer Drone for Farm,"Shandong Aolan Drone Science and Technology Co., Ltd.",drone,Agricultural Equipment,5200.0
No Mapping Required Agricultural Equipment Farm Machines,"Beijing TT Aviation Technology Co., Ltd.",drone,Agricultural Equipment,9999.0
Plant Protection Drone Hot Selling Uav Long Range Spray Agricultural Drone Agricola,"Shandong Aolan Drone Science and Technology Co., Ltd.",drone,Agricultural Equipment,4700.0
Tta Pesticide Spray Machine Chemical Drone Sprayer Agricultural Equipment Machine,"Beijing TT Aviation Technology Co., Ltd.",drone,Agricultural Equipment,6399.0
Best Selling Brushless Electric Machine Foldable Drone Flow RC Drone with Camera,"Shandong Aolan Drone Science and Technology Co., Ltd.",drone,Agricultural Equipment,5200.0
Hot Sales for Big Carry Load 100kg Professional Delivery Drone 200-400kg,"Chongqing Lehman Automobile Service Co., Ltd.",drone,Agricultural Equipment,500000.0
Autel Thermal Drones Robotics Evo 2 Dual 640t Rugged Bundle 8K Camera Drone,QINGDAO HANNSTAR TECHNOLOGY COMPANY LIMITED,drone,Agricultural Equipment,4800.0
Pesticide Spray Machine Chemical Drone Sprayer Agricultural Equipments,"Beijing TT Aviation Technology Co., Ltd.",drone,Agricultural Equipment,1999.0
4K HD Camera Eis 3 Axis Gimbal Long Range 5g WiFi Transmission Video Fpv RC Quadcopter GPS,QINGDAO HANNSTAR TECHNOLOGY COMPANY LIMITED,drone,Agricultural Equipment,399.0
2023 New Arrival Agricultual Spraying Machinery GPS Positioning Farm Fumigation Drone,"Shandong Joyance Intelligence Technology Co., Ltd.",drone,Agricultural Equipment,8999.0
Factory Price Fumigation Agricultural Drone Al4-30L Capacity for GPS Powered,"Shandong Aolan Drone Science and Technology Co., Ltd.",drone,Agricultural Equipment,5200.0
Agriculture Drone Price Uav Manual Sprayer for Farmer Crops Spraying for Sale,"Shandong Aolan Drone Science and Technology Co., Ltd.",drone,Agricultural Equipment,5200.0
Professional Mapping Drone for Agriculture with Long Flight Time,"Ruiyuan Holdings Group International Trade Co., Ltd.",drone,Agricultural Equipment,6099.0
Unmanned Uav Agriculture Drone Uav Drone Professional,"Shanghai Genyond Technology Co., Ltd.",drone,Agricultural Equipment,9300.0
Uav Agras A30L Drone to Fumigate for Plant Irrigation Protection Agricultural Drone Seed Fertilizer,"Shandong Aolan Drone Science and Technology Co., Ltd.",drone,Agricultural Equipment,5200.0
T40 Spraying Uav OEM Agricultural Farm Sprayer Pesticide Drone for Agriculture with Fertilizer,"Shandong Joyance Intelligence Technology Co., Ltd.",drone,Agricultural Equipment,11000.0
Agras Agricultural Drone Agriculture Pesticide Sprayer Agriculture Drone Battery 20kg,"Shandong Aolan Drone Science and Technology Co., Ltd.",drone,Agricultural Equipment,480.0
Plant Protection Uav Manufacturers Agricultural Uav Model Pesticide Spraying Machine Sales,"Beijing TT Aviation Technology Co., Ltd.",drone,Agricultural Equipment,6399.0
25kg Heavy Lift Agriculture Spray Machine Drone Agricultural Sprayer Drone,QINGDAO HANNSTAR TECHNOLOGY COMPANY LIMITED,drone,Agricultural Equipment,2800.0
4 Axis Agricultural Protection Drone Fumigation Machine Sprayer Agriculture Crop,"Shandong Aolan Drone Science and Technology Co., Ltd.",drone,Agricultural Equipment,4700.0
Agricultural Sprayer Drone/ Crop Spraying Drones / Pesticides Spraying Dronespayload Agricultural Pesticide Uav Sprayer Made in China Machine,"Beijing TT Aviation Technology Co., Ltd.",drone,Agricultural Equipment,6399.0
Agricultural Drone Bearing Capacity 100-300kg Logistics Drone,"Chongqing Lehman Automobile Service Co., Ltd.",drone,Agricultural Equipment,500000.0
Agriculture Sprayer Drone with High-Performance Uav Features for Farmers,"Ruiyuan Holdings Group International Trade Co., Ltd.",drone,Agricultural Equipment,65.0
Manufacturer Wholesale Machinery Equipment Agriculture Farming Sprayers Drone 30L,"Shandong Aolan Drone Science and Technology Co., Ltd.",drone,Agricultural Equipment,4200.0
4 Axis Crop Pesticide Sprayer Drone Dustproof Uav Waterproof Agricultural Sprayer Aircraft for Plane for Farming,"Shandong Aolan Drone Science and Technology Co., Ltd.",drone,Agricultural Equipment,4700.0
Crop Pesticide Sprayer Drone Dustproof Intelligent Agricultural Drone for Farm Protection,"Shandong Aolan Drone Science and Technology Co., Ltd.",drone,Agricultural Equipment,4700.0
Plant Sprayer Spraying Spreading Drone Uav Crop Agro Drone Crop Sprayer Aircraft A22 Agriculture Machinery,"Shandong Aolan Drone Science and Technology Co., Ltd.",drone,Agricultural Equipment,4400.0
New Design 10kg Reliable Agricultural Sprayer Remote Controlled Drone for Pesticide Spray,"Beijing TT Aviation Technology Co., Ltd.",drone,Agricultural Equipment,449.0
2025 Agricultural Spray Fumigation Spraying Drones Agriculture Tools Dosing Pump Working Drone Full Size,"Shenzhen Xq-Power Technology Co., Ltd",drone,Agricultural Equipment,8900.0
Flying Camera Drone Wholesaler Vtol Drone Heavy Lift Drone with Longest Flight Time Quadcopter Unmanned Aerial Vehicles Large,"Shenzhen Xingkai Technology Co., Ltd",drone,Agricultural Equipment,10220.0
Professional 10 Litre Sprayer Drone Agricultural Spraying Drones,QINGDAO HANNSTAR TECHNOLOGY COMPANY LIMITED,drone,Agricultural Equipment,2800.0
Professional 10kg Foldable Agriculture Uav Drone Spraying,"Shanghai Genyond Technology Co., Ltd.",drone,Agricultural Equipment,7500.0
New Products A30L Agricultural Spraying Uav Boom Crop Dusting Sprayer Drone Seed Fertilizer Drones for Fumigation,"Shandong Aolan Drone Science and Technology Co., Ltd.",drone,Agricultural Equipment,4700.0
Biggest T40 T50 Agricultural Sprayer Drone for Fertilizers and Pestice,"Shandong Joyance Intelligence Technology Co., Ltd.",drone,Agricultural Equipment,11000.0
Advanced Sprayer Drone for Agriculture with 180 Minutes Fly Time,"Ruiyuan Holdings Group International Trade Co., Ltd.",drone,Agricultural Equipment,5800.0
10L Payload Agriculture Uav/Pesticide Spraying Uav Drone,"Shanghai Genyond Technology Co., Ltd.",drone,Agricultural Equipment,7700.0
Factory Sales Uav Pesticides Spraying Agriculture Sprayer Drone for Pest Control,"Beijing TT Aviation Technology Co., Ltd.",drone,Agricultural Equipment,449.0
3D Map Planning RC Aircraft Thermal Drone Uav Zoom Camera GPS Drone Uav Detection for Project/Agriculture/Industry/Engineering Dji Matrice 30t CCTV Accessories,"Veacam Electronics Co., Ltd",drone,Agricultural Equipment,6799.0
4 Axis 22L Hybrid Spray Agriculture Drone Bodyfor Farm Plants Waterproof Drone Remote Control Multirotor Fuselage,"Shenzhen Xq-Power Technology Co., Ltd",drone,Agricultural Equipment,790.0
Agricultural Disinfectant Garden Plant Protection Drones Pulverizadores Uav 20L Agricultural-Sprayers T20 Agriculture Crop Spraying Uav with Camera,"Shandong China Coal Construction Machinery Co., Ltd.",drone,Agricultural Equipment,900.0
Quadcopters Factory Remote Control Drones Uav Racing Drone Helicopter Drone Quad Copter Drone Unmanned Fpv,"Shenzhen Xingkai Technology Co., Ltd",drone,Agricultural Equipment,455.0
Big Farm Drone Agricultural A22 Drone Farming Crop Sprayer Fumigation Agricultural Irrigation,"Shandong Aolan Drone Science and Technology Co., Ltd.",drone,Agricultural Equipment,5200.0
50L Tank 50kg Spreading Payload Dual Atomized Drone Sprayer Standard Take off Weight 98kg,"Beijing TT Aviation Technology Co., Ltd.",drone,Agricultural Equipment,8999.0
Accurate - Control Agri - Spraying Unmanned Aerial Vehicle Equipment Spraying Drone,"Shandong Gojon Precision Technology Co., Ltd
Shandong Gojon Precision Technology Co., Ltd
Diamond Member
Shandong, China
Audited Supplier
Importers and Exporters
High Repeat Buyers Choice
Multi-language Pioneer
Exhibition Experience
Sign In to see all verified strength labels (19)",drone,Agricultural Equipment,1000.0
Big Payload Agricultural Spray Drone with Carbon Fiber Frame and Remote-Controlled Precision Spraying for Rice and Coffee Field,"Shenzhen Xq-Power Technology Co., Ltd",drone,Agricultural Equipment,7500.0
30L Spraying Spreading Drones Fumigation Spray Plant Protection Remote Control Drone Spray Machine,"Nanjing Zhixingfei Technology Co., Ltd.",drone,Agricultural Equipment,6714.0
Vtol Drone Supplier Flying Camera Drone Remote Control Drones Unmanned Aerial Systems Drone with camera Long Range,"Shenzhen Xingkai Technology Co., Ltd",drone,Agricultural Equipment,10220.0
8K Autel II Dual 640t Thermal Camera Drone with Camera 920g Payload 38 Minutes 25km Long Range Professional Photography,QINGDAO HANNSTAR TECHNOLOGY COMPANY LIMITED,drone,Agricultural Equipment,4800.0
Heavy Load Plant Avoidance Drone Spray Machine Uav Helicopter for Agriculture,"Shandong Aolan Drone Science and Technology Co., Ltd.",drone,Agricultural Equipment,5200.0
35-55 Liter Crop Drone for Agricultural Fumigation T40/60 Light Payload Spraying Fertilizer Drone Agricola Precio for Agriculture Purpose with Fpv Camera,"Shandong China Coal Construction Machinery Co., Ltd.",drone,Agricultural Equipment,900.0
Joyance 40L Agricultural Drone Pesticide Drone for Crop Flying Long Distance,"Shandong Joyance Intelligence Technology Co., Ltd.",drone,Agricultural Equipment,11000.0
Tta Cleaning Drone Window Cleaning Drone Agriculture Spray and Building Agriculture Drone,"Beijing TT Aviation Technology Co., Ltd.",drone,Agricultural Equipment,8999.0
Heavy-Duty Agricultural Drone with Large Payload for Advanced Pest Control and Irrigation,"Shenzhen Xq-Power Technology Co., Ltd",drone,Agricultural Equipment,7500.0
Drone Sprayer Factory Long Distance Drone 16L Agriculture Drone Spraying Drone AG Spray Drone with Night Vision,"Shenzhen Xingkai Technology Co., Ltd",drone,Agricultural Equipment,11600.0
Best Selling RC Drone with 4K Camera and Flow Technology,"Shandong Aolan Drone Science and Technology Co., Ltd.",drone,Agricultural Equipment,5200.0
High Performance Fruit Tree Fertilization New Condition Agriculture Uav Drone for Farms,"Beijing TT Aviation Technology Co., Ltd.",drone,Agricultural Equipment,29800.0
